{
  "schema_version": "holon.repository-continuity-materialization-profile/v1",
  "version": "1.0.0-alpha.1",
  "status": "proposed",
  "owner": "egohygiene/holon",
  "updated": "2026-09-08",
  "purpose": "Pin the portable contract, organization policy, and validator inputs that Holon may later use to plan deterministic repository-continuity materialization without treating mutable branches or unreleased drafts as enforceable authority.",
  "rollout": {
    "stage": "observe",
    "maximum_stage_before_release": "observe",
    "activation_gate": [
      "Aether marks the pinned repository-continuity contract and skill stable and release-included",
      "Hygiene accepts and releases the pinned organization policy",
      "EgoLint releases the pinned continuity rule catalog and report contract",
      "A maintainer explicitly promotes this Holon profile after fixture evidence is reviewed"
    ],
    "unavailable_behavior": "fail-closed-with-explicit-provisional-state"
  },
  "sources": [
    {
      "id": "aether-continuity",
      "role": "portable-contract",
      "repository": "egohygiene/aether",
      "revision": "b7597301c4d22a9bcd580967b5753138bb368111",
      "version": "1.0.0",
      "lifecycle": "draft",
      "release_included": false,
      "artifacts": [
        {
          "id": "repository-continuity-schema",
          "kind": "schema",
          "path": "catalog/schemas/aether.repository-continuity.v1.schema.json",
          "sha256": "a725e004fe0db2bf96a968c6e3f300d37ecf8b00b9a0923be5c5f4c529655916",
          "url": "https://github.com/egohygiene/aether/blob/b7597301c4d22a9bcd580967b5753138bb368111/catalog/schemas/aether.repository-continuity.v1.schema.json"
        },
        {
          "id": "repository-continuity-specification",
          "kind": "specification",
          "path": "library/organization/specs/methodology/repository-continuity.spec.md",
          "sha256": "362b7040a0c3dba3477d37edd641d3bf8fab9a447808d262c9576346eae93dae",
          "url": "https://github.com/egohygiene/aether/blob/b7597301c4d22a9bcd580967b5753138bb368111/library/organization/specs/methodology/repository-continuity.spec.md"
        },
        {
          "id": "repository-continuity-instruction",
          "kind": "instruction",
          "path": "library/organization/instructions/repository-continuity/INSTRUCTION.md",
          "sha256": "dc2fb66bd5268af2416389fef469d2a13c91d1a6f179e6fc10a21d4f890876a8",
          "url": "https://github.com/egohygiene/aether/blob/b7597301c4d22a9bcd580967b5753138bb368111/library/organization/instructions/repository-continuity/INSTRUCTION.md"
        },
        {
          "id": "continuity-dispositions",
          "kind": "disposition-catalog",
          "path": "library/organization/instructions/repository-continuity/continuity-dispositions.v1.json",
          "sha256": "73577902d9bdd2ae5634820c49385ab630c266770f0d5b90c9b1295820e24946",
          "url": "https://github.com/egohygiene/aether/blob/b7597301c4d22a9bcd580967b5753138bb368111/library/organization/instructions/repository-continuity/continuity-dispositions.v1.json"
        },
        {
          "id": "maintain-repository-continuity",
          "kind": "skill",
          "path": "library/organization/skills/methodology/maintain-repository-continuity/SKILL.md",
          "sha256": "1746b29afa62d7a523d87675430730553079e82cf42e46a6ebe7cf8c82d29e8b",
          "url": "https://github.com/egohygiene/aether/blob/b7597301c4d22a9bcd580967b5753138bb368111/library/organization/skills/methodology/maintain-repository-continuity/SKILL.md"
        },
        {
          "id": "continuity-template",
          "kind": "template",
          "path": "library/organization/skills/methodology/maintain-repository-continuity/templates/CONTINUITY.template.md",
          "sha256": "494de90d0c344db9ff41b78998445b9e9c02f23a69c25d48442d2af1de1343f2",
          "url": "https://github.com/egohygiene/aether/blob/b7597301c4d22a9bcd580967b5753138bb368111/library/organization/skills/methodology/maintain-repository-continuity/templates/CONTINUITY.template.md"
        },
        {
          "id": "codex-repository-instructions",
          "kind": "provider-projection",
          "path": "dist/codex/repository/AGENTS.md",
          "sha256": "370ad8291f7601459e12390b48942deffaf82b0acc3557029986035f3081c506",
          "url": "https://github.com/egohygiene/aether/blob/b7597301c4d22a9bcd580967b5753138bb368111/dist/codex/repository/AGENTS.md"
        },
        {
          "id": "claude-repository-instructions",
          "kind": "provider-projection",
          "path": "dist/claude/repository/CLAUDE.md",
          "sha256": "3d7d433db8d3c8cf6d790ff3bcb23e9640493242a20bdabf14d2ad330db079f2",
          "url": "https://github.com/egohygiene/aether/blob/b7597301c4d22a9bcd580967b5753138bb368111/dist/claude/repository/CLAUDE.md"
        },
        {
          "id": "github-copilot-instructions",
          "kind": "provider-projection",
          "path": "dist/github/repository/.github/copilot-instructions.md",
          "sha256": "ff5155ea4a05a4ba46a768103648be3d01d294745c755fa88148287221307ed1",
          "url": "https://github.com/egohygiene/aether/blob/b7597301c4d22a9bcd580967b5753138bb368111/dist/github/repository/.github/copilot-instructions.md"
        }
      ]
    },
    {
      "id": "hygiene-continuity",
      "role": "organization-policy",
      "repository": "egohygiene/hygiene",
      "revision": "43386f5749116717585ead7459b4945e0ac50d06",
      "version": "1.0.0-alpha.1",
      "lifecycle": "proposed",
      "release_included": false,
      "artifacts": [
        {
          "id": "repository-continuity-policy",
          "kind": "policy",
          "path": "catalog/repository-continuity-policy.json",
          "sha256": "a17178482d67e141009b07d6715727612fbf7f372be8c471a124149752c2ca64",
          "url": "https://github.com/egohygiene/hygiene/blob/43386f5749116717585ead7459b4945e0ac50d06/catalog/repository-continuity-policy.json"
        },
        {
          "id": "repository-context-contract",
          "kind": "contract",
          "path": "contracts/repository-context.toml",
          "sha256": "d8eb450bc9532d80050261cf0bd7ca3b0a614a1aad5c2dac53808b7bd146ee8c",
          "url": "https://github.com/egohygiene/hygiene/blob/43386f5749116717585ead7459b4945e0ac50d06/contracts/repository-context.toml"
        },
        {
          "id": "repository-continuity-policy-schema",
          "kind": "schema",
          "path": "schemas/repository-continuity-policy.v1.schema.json",
          "sha256": "287bd030dcff2a3340475e4a7f8fd63e42f5ea4ff557d8f539e067eb8f0050d9",
          "url": "https://github.com/egohygiene/hygiene/blob/43386f5749116717585ead7459b4945e0ac50d06/schemas/repository-continuity-policy.v1.schema.json"
        },
        {
          "id": "repository-context-schema",
          "kind": "schema",
          "path": "schemas/repository-context.v2.schema.json",
          "sha256": "e005216e7d15191f6d7017b4471bcd7380ff40412af51c0aa516a65bdf39c057",
          "url": "https://github.com/egohygiene/hygiene/blob/43386f5749116717585ead7459b4945e0ac50d06/schemas/repository-context.v2.schema.json"
        }
      ]
    },
    {
      "id": "egolint-continuity",
      "role": "validator",
      "repository": "egohygiene/egolint",
      "revision": "786f1b3c59748a66bb092cad9589640f01c5b41d",
      "version": "0.1.0-alpha.1",
      "lifecycle": "proposed",
      "release_included": false,
      "artifacts": [
        {
          "id": "repository-continuity-rule-catalog",
          "kind": "rule-catalog",
          "path": ".config/rules/repository-continuity.v1.toml",
          "sha256": "c4a9bb056526d0176428b47167fd5b4b29ad1803ef1f53b223c43adf4b186528",
          "url": "https://github.com/egohygiene/egolint/blob/786f1b3c59748a66bb092cad9589640f01c5b41d/.config/rules/repository-continuity.v1.toml"
        },
        {
          "id": "repository-continuity-schema",
          "kind": "schema",
          "path": "schemas/repository-continuity.schema.json",
          "sha256": "cf865611886602765a5c56efc89b2910c1bbdde3d75c7668c5e9cdcea994848b",
          "url": "https://github.com/egohygiene/egolint/blob/786f1b3c59748a66bb092cad9589640f01c5b41d/schemas/repository-continuity.schema.json"
        },
        {
          "id": "repository-continuity-report-schema",
          "kind": "report-schema",
          "path": "schemas/repository-continuity-report.schema.json",
          "sha256": "fc9d7c1a9175209e0c958cf74dded0cb974ff86c7d46130e7a7ae731f0147276",
          "url": "https://github.com/egohygiene/egolint/blob/786f1b3c59748a66bb092cad9589640f01c5b41d/schemas/repository-continuity-report.schema.json"
        }
      ]
    }
  ],
  "surfaces": [
    {
      "id": "continuity-checkpoint",
      "path": "CONTINUITY.md",
      "kind": "file",
      "ownership": "repository-owned",
      "strategy": "evidence-grounded-template",
      "source_role": "portable-contract",
      "source_artifact": "continuity-template",
      "begin_marker": null,
      "end_marker": null,
      "required": true
    },
    {
      "id": "agent-instructions",
      "path": "AGENTS.md",
      "kind": "file",
      "ownership": "repository-owned",
      "strategy": "managed-block",
      "source_role": "portable-contract",
      "source_artifact": "codex-repository-instructions",
      "begin_marker": "<!-- BEGIN AETHER REPOSITORY-CONTINUITY -->",
      "end_marker": "<!-- END AETHER REPOSITORY-CONTINUITY -->",
      "required": true
    },
    {
      "id": "github-copilot-instructions",
      "path": ".github/copilot-instructions.md",
      "kind": "file",
      "ownership": "repository-owned",
      "strategy": "managed-block",
      "source_role": "portable-contract",
      "source_artifact": "github-copilot-instructions",
      "begin_marker": "<!-- BEGIN AETHER REPOSITORY-CONTINUITY -->",
      "end_marker": "<!-- END AETHER REPOSITORY-CONTINUITY -->",
      "required": false